Full Program Name,Program,Program Type/Target,Level of Government,Cash to In-Kind Spectrum,Parent
Aboriginal Leadership Opportunities Year,ALOY,"Education, Training, and Employment",Government of Canada,Pure In-Kind,
Canada Child Benefit,Canada Child Benefit,Children and Family,Government of Canada,Pure Cash Transfer,
Canada Education Savings,Canada Education Savings,"Education, Training, and Employment",Government of Canada,Pure Cash Transfer,
Canada Student Grants,Canada Student Grants,"Education, Training, and Employment",Government of Canada,Cash Geared to Cost,
Canada Student Loans,Canada Student Loans,"Education, Training, and Employment",Government of Canada,Cash Geared to Cost,
Canada Training Credit,Canada Training Credit,"Education, Training, and Employment",Government of Canada,Pure In-Kind,
Canada Worker's Benefit ,Canada Worker's Benefit ,Financial Supports: Work-Related,Government of Canada,Refundable tax credit,
Canadian Benefit for Parents of Young Victims of Crime,Victims of Crime,Financial Supports: Work-Related,Government of Canada,Pure Cash Transfer,
Canadian Forces Disability Benefits,Disability Benefits,Financial Supports: Non-Work,Government of Canada,Pure Cash Transfer,
Canadian Forces Income Replacement Benefit,Income Replacement,Financial Supports: Work-Related,Government of Canada,Pure Cash Transfer,
Canadian Forces Income Support,Income Support,Financial Supports: Non-Work,Government of Canada,Pure Cash Transfer,
Child Disability Benefit,Child Disability Benefit,Children and Family,Government of Canada,Pure Cash Transfer,
Canada Pension Plan,Canada Pension Plan,Financial Supports: Work-Related,Government of Canada,Pure Cash Transfer,
Disability Savings,Disability Savings,Financial Supports: Non-Work,Government of Canada,Pure Cash Transfer,
Disability Tax Credit,Disability Tax Credit,Financial Supports: Non-Work,Government of Canada,Non-refundable tax credit,
Education and Training Benefit (Veterans),Education & Training,"Education, Training, and Employment",Government of Canada,Cash Geared to Cost,
Employment Insurance,Employment Insurance,Financial Supports: Non-Work,Government of Canada,Pure Cash Transfer,
Excise Gasoline Tax Refund,Excise Gasoline Refund,Financial Supports: Non-Work,Government of Canada,Bill Refund,
Federal Internship for Newcomers Program,Newcomers Internship,"Education, Training, and Employment",Government of Canada,Pure In-Kind,
First Nation & Inuit post-secondary student support program,PSSSP,"Education, Training, and Employment",Government of Canada,Cash Geared to Cost,
First Time Home Buyer Incentive,FTHBI,Housing,Government of Canada,Pure In-Kind,
GST/HST Credit,GST/HST Credit,Financial Supports: Non-Work,Government of Canada,Pure Cash Transfer,
GST/HST New Housing Rebate,New Housing Rebate,Housing,Government of Canada,Bill Refund,
Guaranteed Income Supplement,GIS,Financial Supports: Non-Work,Government of Canada,Pure Cash Transfer,
Home Buyer's Plan,Home Buyer's Plan,Housing,Government of Canada,Pure In-Kind,
Housing Internship for First Nation and Inuit Youth,HIIFNIY,"Education, Training, and Employment",Government of Canada,Pure In-Kind,
Housing Supply Challenge,Housing Supply,Housing,Government of Canada,Services,
Immigration Loans Program ,Immigation Loans,Financial Supports: Non-Work,Government of Canada,Cash Geared to Cost,
Indian Residential Schools Resolution Health Support Program,IRS RHSP,Medical/Health,Government of Canada,Pure In-Kind,
Language Instruction for Newcomers to Canada,LINC,"Education, Training, and Employment",Government of Canada,Pure In-Kind,
Medical Expenses Tax Credit,Medical Expense Credit,Medical/Health,Government of Canada,Non-refundable tax credit,
Non-Insured Health Benefits Program,NIHB,Medical/Health,Government of Canada,Pure In-Kind,
Old Age Security Pension,OAS,Financial Supports: Non-Work,Government of Canada,Pure Cash Transfer,
Resettlement Assistance Program,Resettlement Assistance,Financial Supports: Non-Work,Government of Canada,Pure In-Kind,
Right of Permanent Residence Fee Loan,Right of PR loan,Financial Supports: Non-Work,Government of Canada,Pure In-Kind,
Skills Link,Skills Link,"Education, Training, and Employment",Government of Canada,Pure In-Kind,
Veteran Exceptional Incapacity Allowance,Incapacity Allowance,Financial Supports: Non-Work,Government of Canada,Pure Cash Transfer,
Veteran's Attendance Allowance,Attendance Allowance,Financial Supports: Non-Work,Government of Canada,Cash Geared to Cost,
Veteran's Detention Benefit,Detention Benefit,Financial Supports: Non-Work,Government of Canada,Pure Cash Transfer,
Veteran's Independence Program,Independence,Financial Supports: Non-Work,Government of Canada,Pure In-Kind OR Bill Refund,
Veteran's Independence Program for Survivors,Independence for Survivors,Financial Supports: Non-Work,Government of Canada,Pure In-Kind OR Bill Refund,
Veterans Clothing Allowance,Clothing Allowance,Financial Supports: Non-Work,Government of Canada,Cash Geared to Cost,
War Veteran's Funeral and Burial Assistance,War Vet Funeral Assistance,Financial Supports: Non-Work,Government of Canada,Pure In-Kind,
War Veteran's Prisoner of War Compensation,War Vet POW Comp.,Financial Supports: Non-Work,Government of Canada,Pure Cash Transfer,
War Veterans Allowance,War Vet Allowance,Financial Supports: Non-Work,Government of Canada,Pure Cash Transfer,
War Veterans Death Benefit,War Vet Death Benefit,Financial Supports: Non-Work,Government of Canada,Pure Cash Transfer,
Western Canada Business Services Network,Western Business Services Network,"Education, Training, and Employment",Government of Canada,Services,
Work Integrated Learning Opportunities/work placements,Work Placements,"Education, Training, and Employment",Government of Canada,Services,
Federal Worker's Comp.,Federal Worker's Comp.,Financial Supports: Work-Related,Government of Canada,Pure Cash Transfer,
Recreation Financial Assistance Programs,Rec. Fee Assistance,Financial Supports: Non-Work,Government of B.C.,Pure In-Kind,
Rent Banks,Rent Banks,Housing,Municipal,Pure In-Kind,
Aboriginal Community-Based Training Partnerships Program,ACBTP,"Education, Training, and Employment",Government of B.C.,Services,
Aboriginal Emergency Assistance Fund (post-secondary),AEAF,"Education, Training, and Employment",Government of B.C.,Pure Cash Transfer,
Affordable Child Care Benefit,ACCB,Children and Family,Government of B.C.,Pure In-Kind,
Affordable Rental Housing,Affordable Rental Housing,Housing,Government of B.C.,Pure In-Kind,
Agreements with Young Adults,AYA,"Education, Training, and Employment",Government of B.C.,Cash Geared to Cost,
BC access grant for students with permanent disabilities,Access Grant,"Education, Training, and Employment",Government of B.C.,Pure In-Kind,
BC Bus Pass for Seniors,Senior Bus Pass,Financial Supports: Non-Work,Government of B.C.,Pure In-Kind,
BC Child Opportunity Benefit,Child Opportunity,Children and Family,Government of B.C.,Pure Cash Transfer,
BC Climate Action Tax Credit,Climate Action Credit,Financial Supports: Non-Work,Government of B.C.,Pure Cash Transfer,
BC Education and Training Savings Grant ,Education Savings Grant,"Education, Training, and Employment",Government of B.C.,Pure Cash Transfer,
BC Farmer's Market Nutrition Program,Nutrition Program,Financial Supports: Non-Work,Government of B.C.,Pure In-Kind,
BC Home Renovation Tax Credit,Home Renovation,Housing,Government of B.C.,Refundable tax credit,
BC Hydro Customer Crisis Fund,Crisis Fund,Housing,Government of B.C.,Pure In-Kind,
BC Sales Tax Credit,Sales Tax Credit,Financial Supports: Non-Work,Government of B.C.,Refundable tax credit,
BC Tax Reduction Credit,Tax Reduction Credit,Financial Supports: Non-Work,Government of B.C.,Non-refundable tax credit,
Career Paths for Skilled Immigrants,Career Paths,"Education, Training, and Employment",Government of B.C.,Pure In-Kind,
Child Care Operating Funding ,CCOF,Children and Family,Government of B.C.,Cash Geared to Cost,
Childcare Fee Reduction Initiative,CCFRI,Children and Family,Government of B.C.,Pure In-Kind,
Christmas Supplement,X-mas Supp.,Financial Supports: Non-Work,Government of B.C.,Pure Cash Transfer,General Supplements
Clothing Supplement for People in Special Care Facilities,Clothing Supp.,Financial Supports: Non-Work,Government of B.C.,Cash Geared to Cost,General Supplements
Co-op Share Purchase Supplement,Co-op Share Supp.,Housing,Government of B.C.,Cash Geared to Cost,General Supplements
Community Adult Literacy Program,Adult Literacy,"Education, Training, and Employment",Government of B.C.,Pure In-Kind,
Workforce Development Agreement Programs,WDA,"Education, Training, and Employment",Government of B.C.,Pure In-Kind,
CommunityLink Funding and Vulnerable Student Supplement,CommunityLink & VSS,Financial Supports: Non-Work,Government of B.C.,Pure In-Kind,
Confirmed Job Supplement,Confirmed Job Supp.,Financial Supports: Non-Work,Government of B.C.,Cash Geared to Cost,General Supplements
Crime Victim Assistance Program,CVAP,Financial Supports: Non-Work,Government of B.C.,Pure In-Kind,
Crisis Supplement,Crisis Supp.,Financial Supports: Non-Work,Government of B.C.,Pure Cash Transfer,General Supplements
Dental: Crown and bridge work,Dental: crown and bridge,Medical/Health,Government of B.C.,Pure In-Kind,Health Supplements
Dental: Orthodontic Services,Dental: Orthodontic,Medical/Health,Government of B.C.,Pure In-Kind,Health Supplements
Diet Supplements,Diet Supp.,Medical/Health,Government of B.C.,Cash Geared to Cost,Health Supplements
Disability Assistance,Disability Assistance,Financial Supports: Non-Work,Government of B.C.,Pure Cash Transfer,
Emergency Dental Services & Denture Services,Emergency Dental,Medical/Health,Government of B.C.,Pure In-Kind,Health Supplements
Energy Conservation Assistance Program,ECAP,Housing,Government of B.C.,Pure In-Kind,
Extended Medical Therapies,Extended Medical,Medical/Health,Government of B.C.,Pure In-Kind,Health Supplements
Fair Pharmacare,Fair Pharmacare,Medical/Health,Government of B.C.,Pure In-Kind,
Family Maintenance Services,Family Maintenance,Children and Family,Government of B.C.,Pure In-Kind,General Supplements
Fuel Tax Refund for Persons with Disabilities,Fuel Tax Refund PWD,Financial Supports: Non-Work,Government of B.C.,Bill Refund,
Funeral Costs,Funeral,Financial Supports: Non-Work,Government of B.C.,Pure In-Kind,General Supplements
Guide Dog and Service Dog Supplement,Guide Dog Supp.,Medical/Health,Government of B.C.,Cash Geared to Cost,General Supplements
Hardship Assistance,Hardship Assistance,Financial Supports: Non-Work,Government of B.C.,Pure Cash Transfer,
Healthy Kids Program,Healthy Kids,Medical/Health,Government of B.C.,Pure In-Kind,
Home Adaptations for Independence,Home Adaptions,Housing,Government of B.C.,Bill Refund,
Home Owner Grant,HOG,Housing,Government of B.C.,Pure In-Kind,
Homeless Rent Supplements,Homeless Rent Supp.,Housing,Government of B.C.,Pure In-Kind,
Homeless Shelters ,Shelters,Housing,Government of B.C.,Pure In-Kind,
Identification Supplement,ID Supp.,Financial Supports: Non-Work,Government of B.C.,Cash Geared to Cost,General Supplements
Income Assistance,Income Assistance,Financial Supports: Non-Work,Government of B.C.,Pure Cash Transfer,
Independent Living ,Independent Living ,Housing,Government of B.C.,Pure In-Kind,
Indigenous Skills Training Development Fund,ISTDF,"Education, Training, and Employment",Government of B.C.,Services,
Legal Aid,Legal Aid,Financial Supports: Non-Work,Government of B.C.,Pure In-Kind,
Life Threatening Health Need,Life Threatening,Medical/Health,Government of B.C.,Pure In-Kind,
Medical Equipment - Orthoses,Med. Equip. - Orthoses,Medical/Health,Government of B.C.,Pure In-Kind,Health Supplements
Medical Equipment and Devices,Med. Equip. & Devices,Medical/Health,Government of B.C.,Pure In-Kind,Health Supplements
Medical Equipment- Hearing Instruments,Med. Equip. - Hearing,Medical/Health,Government of B.C.,Pure In-Kind,Health Supplements
Medical Services Only,MSO,Medical/Health,Government of B.C.,Pure In-Kind,
Medical Supplies,Med. Supplies,Medical/Health,Government of B.C.,Pure In-Kind,Health Supplements
Medical Transportation Supplement,Med. Transport,Medical/Health,Government of B.C.,Cash Geared to Cost,Health Supplements
Monthly Nutritional Supplement,Nutrition Supp. ,Medical/Health,Government of B.C.,Cash Geared to Cost,Health Supplements
"Moving, Transportation and Living Costs",Moving & Transport Supp.,Housing,Government of B.C.,Cash Geared to Cost,General Supplements
Natal Supplement,Natal Supp. ,Medical/Health,Government of B.C.,Cash Geared to Cost,General Supplements
Nutritional Supplement: infant formula,Infant Formula Supp. ,Children and Family,Government of B.C.,Pure In-Kind,Health Supplements
Nutritional Supplement: Short-Term,Short-term Nutrition Supp.,Medical/Health,Government of B.C.,Pure In-Kind,Health Supplements
Optical Services,Optical,Medical/Health,Government of B.C.,Pure In-Kind,Health Supplements
Pre-natal Shelter Supplement,Pre-natal Shelter Supp.,Housing,Government of B.C.,Cash Geared to Cost,General Supplements
Property Tax Deferral,PTD,Housing,Government of B.C.,Pure In-Kind,
Provincial Tuition Waiver Program,Tuition Waiver,"Education, Training, and Employment",Government of B.C.,Pure In-Kind,
Rental Assistance Program,RAP,Housing,Government of B.C.,Cash Geared to Cost,
School Start-up Supplement,School Start-up Supp.,Children and Family,Government of B.C.,Pure Cash Transfer,General Supplements
Sector Labour Market Partnership Program,Senior LMP,"Education, Training, and Employment",Government of B.C.,Services,
Security Deposits,Security Deposit,Housing,Government of B.C.,Cash Geared to Cost,General Supplements
Seniors Supplement,Seniors Supplement,Financial Supports: Non-Work,Government of B.C.,Pure Cash Transfer,
Seniors' Supportive Housing,Seniors' Support Housing,Housing,Government of B.C.,Pure In-Kind,
Shelter Aid for Elderly Renters,SAFER,Housing,Government of B.C.,Cash Geared to Cost,
"StudentAid BC: bursaries, loans, grants",StudentAid,"Education, Training, and Employment",Government of B.C.,Cash Geared to Cost,
Subsidized Rental Housing,Subsidized Rental,Housing,Government of B.C.,Pure In-Kind,
Supplement for Alcohol and Drug Treatment,Alcohol & Drug Treat.,Medical/Health,Government of B.C.,Pure In-Kind OR Bill Refund,Health Supplements
Supplementary Health Care Benefits ,Supp. Health Care,Medical/Health,Government of B.C.,Pure In-Kind,
Supportive Housing (for low income adults),Supportive Housing,Housing,Government of B.C.,Pure In-Kind,
Temporary Child Benefits Top-Up Supplement,Temp. Child Ben. Top-up,Children and Family,Government of B.C.,Pure Cash Transfer,General Supplements
Women's Transition Housing and Supports,Transition Houses,Housing,Government of B.C.,Pure In-Kind,
Transitional Health Services,THS,Medical/Health,Government of B.C.,Pure In-Kind,
Transportation Supplement  ,Transport Supp.,Financial Supports: Non-Work,Government of B.C.,Pure In-Kind,General Supplements
Transportation to Alcohol and Drug Facilities,Transport to Alcohol & Drug Fac.,Financial Supports: Non-Work,Government of B.C.,Pure In-Kind OR Bill Refund,General Supplements
Travel Supplement,Travel Supp. ,"Education, Training, and Employment",Government of B.C.,Cash Geared to Cost,General Supplements
Tube Feed Supplement,Tube Feed Supp. ,Medical/Health,Government of B.C.,Pure In-Kind,Health Supplements
Utility Security Deposits,Utility Deposit,Housing,Government of B.C.,Cash Geared to Cost,General Supplements
Victim Travel Fund,Victim Travel Fund,Financial Supports: Non-Work,Government of B.C.,Cash Geared to Cost,
Labour Market Development Agreement Programs,LMDA,"Education, Training, and Employment",Government of B.C.,Pure In-Kind,
Labour Market Development Agreement Programs,LMDA,"Education, Training, and Employment",Government of B.C.,Cash Geared to Cost,
WorkBC  Employment Services (LMDA),Employ. Services,"Education, Training, and Employment",Government of B.C.,Pure In-Kind,Labour Market Development Agreement Programs
WorkBC Apprentice Services (LMDA),Apprenticeship Services,"Education, Training, and Employment",Government of B.C.,Cash Geared to Cost,Labour Market Development Agreement Programs
WorkBC Assistive Technology Services (LMDA),Assistive Tech. ,"Education, Training, and Employment",Government of B.C.,Pure In-Kind,Labour Market Development Agreement Programs
WorkBC Single Parent Employment Initiative (LMDA),Singple Parent Employ. Services,"Education, Training, and Employment",Government of B.C.,Cash Geared to Cost,Labour Market Development Agreement Programs
WorkBC: The Community and Employer Partnerships Program (LMDA),CEP,"Education, Training, and Employment",Government of B.C.,Pure Cash Transfer,Labour Market Development Agreement Programs
WorkSafe BC: Health Care Benefits,Health Care Benefits,Financial Supports: Work-Related,Government of B.C.,Pure In-Kind,
WorkSafe BC: Permanent Disability Benefit ,Perm Disability Benefit,Financial Supports: Work-Related,Government of B.C.,Pure Cash Transfer,
WorkSafe BC: Wage loss benefits,Wage Loss Benefits,Financial Supports: Work-Related,Government of B.C.,Pure Cash Transfer,
Youth Educational Assistance Fund for Former Youth in Care,YEAF,"Education, Training, and Employment",Government of B.C.,Cash Geared to Cost,
RDSP ,RDSP ,Financial Supports: Non-Work,Government of Canada,Voluntary Savings,
RESP,RESP,"Education, Training, and Employment",Government of Canada,Voluntary Savings,
RRSP,RRSP,Financial Supports: Non-Work,Government of Canada,Voluntary Savings,
TFSA,TFSA,Financial Supports: Non-Work,Government of Canada,Voluntary Savings,
Allowance ,Allowance ,Financial Supports: Non-Work,Government of Canada,Pure Cash Transfer,
Apprenticeship Grants,Apprenticeship Grants,"Education, Training, and Employment",Government of Canada,Pure Cash Transfer,
General Supplements,General Supplements,Financial Supports: Non-Work,Government of B.C.,Pure Cash Transfer,
General Supplements,General Supplements,Financial Supports: Non-Work,Government of B.C.,Cash Geared to Cost,
General Supplements,General Supplements,Financial Supports: Non-Work,Government of B.C.,Pure In-Kind,
General Supplements,General Supplements,"Education, Training, and Employment",Government of B.C.,Cash Geared to Cost,
General Supplements,General Supplements,Housing,Government of B.C.,Cash Geared to Cost,
General Supplements,General Supplements,Children and Family,Government of B.C.,Pure Cash Transfer,
Health Supplements,Health Supp.,Medical/Health,Government of B.C.,Pure In-Kind OR Bill Refund,
Health Supplements,Health Supp.,Medical/Health,Government of B.C.,Pure In-Kind,
Health Supplements,Health Supp.,Medical/Health,Government of B.C.,Cash Geared to Cost,
Alternative Hearing Assistance Supplement,Alternative Hearing Supp. ,Medical/Health,Government of B.C.,Pure In-Kind,Health Supplements
Automatic Child Benefits Top-Up Supplement,Auto. Child Ben. Top-up,Children and Family,Government of B.C.,Pure Cash Transfer,General Supplements
Basic Dental Services,Basic Dental,Medical/Health,Government of B.C.,Pure In-Kind,Health Supplements
Camp Fees Supplement,Camp Fees Supp. ,Children and Family,Government of B.C.,Pure In-Kind OR Bill Refund,General Supplements